{
  "mappingVersion": "paprnav-ad-v4-obligation-mapping-1",
  "generatorVersion": "paprnav-ad-v4-obligation-mapgen-1",
  "generatorSourceSha256": "d3968bbf4a53c99cd7315441c06a671a94b436631238e0c442f420f488da4c9d",
  "resourceLimits": {
    "maxDepth": 64,
    "maxTotalNodes": 75000,
    "maxStringLength": 16384,
    "maxArrayItems": 2000,
    "maxAstNodes": 20000,
    "maxGraphEdges": 40000,
    "maxInternalInteger": 2147483647
  },
  "domains": {
    "subtree": "paprnav:ad_extraction_v4:obligation-subtree:paprnav-ad-v4-c14n-2\\0",
    "projection": "paprnav:ad_extraction_v4:obligation-projection:1\\0",
    "row": "paprnav:ad_extraction_v4:obligation-row:1\\0",
    "request": "paprnav:ad_extraction_v4:obligation-request:1\\0",
    "authClaims": "paprnav:ad_extraction_v4:obligation-auth-claims:1\\0",
    "event": "paprnav:ad_extraction_v4:obligation-projection-event:1\\0",
    "correctionBindingSet": "paprnav:ad_extraction_v4:obligation-correction-binding-set:1\\0",
    "legacyApplicabilityRow": "paprnav:ad_extraction_v4:applicability-row:2\\0"
  },
  "correctionCompatibility": {
    "namespaces": [
      {"namespace": "directiveIdentity", "ownerSlice": "foundation", "targetNodeType": null},
      {"namespace": "supersessionRelations", "ownerSlice": "foundation", "targetNodeType": null},
      {"namespace": "productScopes", "ownerSlice": "slice_3a", "targetNodeType": "product_scope"},
      {"namespace": "conditionDefinitions", "ownerSlice": "slice_3a", "targetNodeType": "condition"},
      {"namespace": "applicabilityRules", "ownerSlice": "slice_3a", "targetNodeType": "applicability_rule"},
      {"namespace": "requirements", "ownerSlice": "slice_3b", "targetNodeType": "requirement"},
      {"namespace": "recurrenceGroups", "ownerSlice": "slice_3b", "targetNodeType": "recurrence_group"},
      {"namespace": "amocAuthorityProvisions", "ownerSlice": "slice_3b", "targetNodeType": "amoc_provision"}
    ],
    "identityDomainKeys": {
      "correctionRoot": "legacyApplicabilityRow",
      "correctionReference": "legacyApplicabilityRow",
      "slice3aBinding": "legacyApplicabilityRow",
      "slice3bBinding": "row"
    }
  },
  "rootFields": [
    "incorporatedDocuments",
    "requirements",
    "recurrenceGroups",
    "amocAuthorityProvisions"
  ],
  "structuralCounts": [
    "semanticNodeCount",
    "datumCount",
    "evidenceLinkCount",
    "documentCount",
    "valueAssertionCount",
    "requirementCount",
    "actionCount",
    "actionStepCount",
    "actionDocumentRefCount",
    "branchCount",
    "expressionCount",
    "expressionEdgeCount",
    "requirementDependencyCount",
    "timingGroupCount",
    "timingTermCount",
    "recurrenceCount",
    "terminatingEffectCount",
    "terminationEdgeCount",
    "recurrenceGroupCount",
    "recurrenceGroupMemberCount",
    "amocProvisionCount",
    "correctionBindingCount"
  ],
  "occurrences": [
    {
      "id": "D1",
      "selector": [{"op": "field", "name": "incorporatedDocuments"}, {"op": "each", "capture": "i"}],
      "presence": "required",
      "nodeType": "incorporated_document",
      "key": {"op": "property", "name": "documentRefKey"},
      "parent": {"op": "root"},
      "ordinal": {"op": "array_ordinal"},
      "ownerTable": "ad_v4_candidate_obligation_documents",
      "evidence": {"source": "own", "purpose": "incorporated_document_clause", "cardinality": "one_or_more", "inheritance": "none"}
    },
    {
      "id": "D2",
      "selector": [{"op": "field", "name": "incorporatedDocuments"}, {"op": "each", "capture": "i"}, {"op": "field", "name": "documentNumber"}],
      "presence": "required",
      "nodeType": "value_assertion",
      "key": {"op": "source_pointer"},
      "parent": {"op": "ancestor", "name": "D1"},
      "ordinal": {"op": "constant", "value": 0},
      "ownerTable": "ad_v4_candidate_obligation_value_assertions",
      "ownerKind": "document_number",
      "evidence": {"source": "own", "purpose": "document_identity", "cardinality": "one_or_more", "inheritance": "none"}
    },
    {
      "id": "D3",
      "selector": [{"op": "field", "name": "incorporatedDocuments"}, {"op": "each", "capture": "i"}, {"op": "field", "name": "revision"}],
      "presence": "required",
      "nodeType": "value_assertion",
      "key": {"op": "source_pointer"},
      "parent": {"op": "ancestor", "name": "D1"},
      "ordinal": {"op": "constant", "value": 1},
      "ownerTable": "ad_v4_candidate_obligation_value_assertions",
      "ownerKind": "revision",
      "evidence": {"source": "own", "purpose": "document_identity", "cardinality": "one_or_more", "inheritance": "none"}
    },
    {
      "id": "D4",
      "selector": [{"op": "field", "name": "incorporatedDocuments"}, {"op": "each", "capture": "i"}, {"op": "field", "name": "retention"}],
      "presence": "required",
      "nodeType": "value_assertion",
      "key": {"op": "source_pointer"},
      "parent": {"op": "ancestor", "name": "D1"},
      "ordinal": {"op": "constant", "value": 2},
      "ownerTable": "ad_v4_candidate_obligation_value_assertions",
      "ownerKind": "retention",
      "allowedUnionBranches": ["unknown"],
      "evidence": {"source": "own", "purpose": "document_retention", "cardinality": "one_or_more", "inheritance": "none"}
    },
    {
      "id": "Q1",
      "selector": [{"op": "field", "name": "requirements"}, {"op": "each", "capture": "i"}],
      "presence": "required",
      "nodeType": "requirement",
      "key": {"op": "property", "name": "requirementKey"},
      "parent": {"op": "root"},
      "ordinal": {"op": "array_ordinal"},
      "ownerTable": "ad_v4_candidate_obligation_requirements",
      "evidence": {"source": "own", "purpose": "requirement_clause", "cardinality": "one_or_more", "inheritance": "none"}
    },
    {
      "id": "Q2",
      "selector": [{"op": "field", "name": "requirements"}, {"op": "each", "capture": "i"}, {"op": "field", "name": "action"}],
      "presence": "required",
      "nodeType": "action",
      "key": {"op": "source_pointer"},
      "parent": {"op": "ancestor", "name": "Q1"},
      "ordinal": {"op": "constant", "value": 0},
      "ownerTable": "ad_v4_candidate_obligation_actions",
      "evidence": {"source": "own", "purpose": "action_clause", "cardinality": "one_or_more", "inheritance": "none"}
    },
    {
      "id": "Q3",
      "selector": [{"op": "field", "name": "requirements"}, {"op": "each", "capture": "i"}, {"op": "field", "name": "action"}, {"op": "field", "name": "orderedSteps"}, {"op": "each", "capture": "j"}],
      "presence": "optional",
      "nodeType": "action_step",
      "key": {"op": "source_pointer"},
      "parent": {"op": "ancestor", "name": "Q2"},
      "ordinal": {"op": "array_ordinal"},
      "ownerTable": "ad_v4_candidate_obligation_action_steps",
      "evidence": {"source": "none", "purpose": null, "cardinality": "zero", "inheritance": "none"}
    },
    {
      "id": "Q5",
      "selector": [{"op": "field", "name": "requirements"}, {"op": "each", "capture": "i"}, {"op": "field", "name": "branch"}],
      "presence": "required",
      "nodeType": "branch",
      "key": {"op": "source_pointer"},
      "parent": {"op": "ancestor", "name": "Q1"},
      "ordinal": {"op": "constant", "value": 2},
      "ownerTable": "ad_v4_candidate_obligation_branches",
      "evidence": {"source": "own", "purpose": "branch_clause", "cardinality": "one_or_more", "inheritance": "none"}
    },
    {
      "id": "Q7",
      "selector": [{"op": "field", "name": "requirements"}, {"op": "each", "capture": "i"}, {"op": "field", "name": "terminatingEffect"}],
      "presence": "required",
      "nodeType": "terminating_effect",
      "key": {"op": "source_pointer"},
      "parent": {"op": "ancestor", "name": "Q1"},
      "ordinal": {"op": "constant", "value": 5},
      "ownerTable": "ad_v4_candidate_obligation_terminating_effects",
      "evidence": {"source": "own", "purpose": "termination_clause", "cardinality": "one_or_more", "inheritance": "none"}
    },
    {
      "id": "EACT",
      "selector": [{"op": "field", "name": "requirements"}, {"op": "each", "capture": "i"}, {"op": "field", "name": "activationExpression"}],
      "presence": "required",
      "nodeType": "expression",
      "key": {"op": "source_pointer"},
      "parent": {"op": "ancestor", "name": "Q1"},
      "ordinal": {"op": "constant", "value": 1},
      "ownerTable": "ad_v4_candidate_obligation_expressions",
      "ownerKind": "recursive_tree",
      "context": "activation",
      "evidence": {"source": "none", "purpose": null, "cardinality": "zero", "inheritance": "none"}
    },
    {
      "id": "EBR",
      "selector": [{"op": "field", "name": "requirements"}, {"op": "each", "capture": "i"}, {"op": "field", "name": "branch"}, {"op": "field", "name": "conditionExpression"}],
      "presence": "union",
      "nodeType": "expression",
      "key": {"op": "source_pointer"},
      "parent": {"op": "ancestor", "name": "Q5"},
      "ordinal": {"op": "constant", "value": 0},
      "ownerTable": "ad_v4_candidate_obligation_expressions",
      "ownerKind": "recursive_tree",
      "context": "branch_condition",
      "evidence": {"source": "none", "purpose": null, "cardinality": "zero", "inheritance": "none"}
    },
    {
      "id": "T1",
      "selector": [{"op": "field", "name": "requirements"}, {"op": "each", "capture": "i"}, {"op": "field", "name": "initialTiming"}],
      "presence": "required",
      "nodeType": "timing_group",
      "key": {"op": "source_pointer"},
      "parent": {"op": "ancestor", "name": "Q1"},
      "ordinal": {"op": "constant", "value": 3},
      "ownerTable": "ad_v4_candidate_obligation_timing_groups",
      "ownerKind": "requirement_initial",
      "evidence": {"source": "own", "purpose": "timing_clause", "cardinality": "one_or_more", "inheritance": "none"}
    },
    {
      "id": "T5I",